{"$schema":"https://json-schema.org/draft/2020-12/schema","$id":"https://catalog.local/schemas/v1/inclusion-decision.schema.json","title":"inclusion-decision","type":"object","additionalProperties":false,"required":["schema_version","product_identity","decision","rule_version","readiness","blocking_findings","applied_approvals","exclusion_reason","normalized_product_fingerprint","asset_set_fingerprint","category_mapping_fingerprint","policy_fingerprint","decision_fingerprint"],"properties":{"schema_version":{"const":"1.0.0"},"product_identity":{"type":["string","null"]},"decision":{"enum":["include","exclude","blocked"]},"rule_version":{"const":"catalog-audit-v1"},"readiness":{"enum":["audit_blocked","manual_review_required","category_mapping_required","commercial_policy_required","schema_decision_required","asset_review_required","package_eligible","package_excluded"]},"blocking_findings":{"type":"array","uniqueItems":true,"items":{"type":"string"}},"applied_approvals":{"type":"array","uniqueItems":true,"items":{"type":"string"}},"exclusion_reason":{"type":["object","null"],"properties":{"decision_id":{"type":"string","minLength":1},"rule_id":{"type":"string","minLength":1},"rule_version":{"type":"string","minLength":1},"reason_code":{"type":"string","minLength":1},"evidence_references":{"type":"array","minItems":1,"uniqueItems":true,"items":{"type":"string"}}},"required":["decision_id","rule_id","rule_version","reason_code","evidence_references"],"additionalProperties":false},"normalized_product_fingerprint":{"$ref":"common-definitions.schema.json#/$defs/sha256"},"asset_set_fingerprint":{"$ref":"common-definitions.schema.json#/$defs/sha256"},"category_mapping_fingerprint":{"$ref":"common-definitions.schema.json#/$defs/sha256"},"policy_fingerprint":{"$ref":"common-definitions.schema.json#/$defs/sha256"},"decision_fingerprint":{"$ref":"common-definitions.schema.json#/$defs/sha256"}}}
