{"schema_version":"1.0.0","product_identity":"fixture-product","decision":"include","rule_version":"catalog-audit-v1","readiness":"package_eligible","blocking_findings":[],"applied_approvals":[],"exclusion_reason":null,"normalized_product_fingerprint":"aaaaaaaaaaaaaaaaaaaaaaaaaaaaaaaaaaaaaaaaaaaaaaaaaaaaaaaaaaaaaaaa","asset_set_fingerprint":"bbbbbbbbbbbbbbbbbbbbbbbbbbbbbbbbbbbbbbbbbbbbbbbbbbbbbbbbbbbbbbbb","category_mapping_fingerprint":"cccccccccccccccccccccccccccccccccccccccccccccccccccccccccccccccc","policy_fingerprint":"dddddddddddddddddddddddddddddddddddddddddddddddddddddddddddddddd","decision_fingerprint":"eeeeeeeeeeeeeeeeeeeeeeeeeeeeeeeeeeeeeeeeeeeeeeeeeeeeeeeeeeeeeeee"}
